{
  "schema_version": "1.0",
  "tenant_id": "10000000-0000-4000-8000-000000000001",
  "installation_id": "30000000-0000-4000-8000-000000000001",
  "provider": "jira",
  "delivery_id": "atlassian-delivery-ast-142-v7",
  "event_type": "jira:issue_updated",
  "external_object_id": "AST-142",
  "external_version": "7",
  "observed_at": "2026-07-13T15:45:00Z",
  "source_updated_at": "2026-07-13T15:45:00Z",
  "payload_sha256": "ba671758e02d1f8ccf68c8fa75e991545261dc9a5416d2ebab9ecc09dd2f661b",
  "payload_object_uri": "s3://edt-fixtures/tenant/10000000-0000-4000-8000-000000000001/connector/30000000-0000-4000-8000-000000000001/sha256/ba671758e02d1f8ccf68c8fa75e991545261dc9a5416d2ebab9ecc09dd2f661b",
  "ingest_run_id": "52000000-0000-4000-8000-000000000142",
  "payload": {
    "id": "10142",
    "key": "AST-142",
    "fields": {
      "summary": "Complete SSO cutover",
      "status": {"id": "3", "name": "In Progress"},
      "priority": {"id": "3", "name": "Medium"},
      "labels": ["identity", "orion"],
      "duedate": "2026-08-07",
      "updated": "2026-07-13T15:45:00Z",
      "project": {"id": "10000", "key": "AST"},
      "issuetype": {"id": "10001", "name": "Task"},
      "issuelinks": [],
      "description": {"type": "doc", "version": 1, "content": []},
      "provider_additive_field": "accepted-only-inside-untrusted-payload"
    }
  }
}
